{
  "contract": "rendertaxi.plugin.capture-manifest",
  "contractVersion": "1.3.0",
  "captureId": "0199953c-2a40-7c11-9e6b-4f3a8d2c7b15",
  "createdAt": "2026-09-29T12:00:00.000Z",
  "source": {
    "host": {
      "key": "example-host",
      "version": "5.2"
    },
    "plugin": {
      "identifier": "ai.rendertaxi.plugin.example",
      "version": "0.3.0"
    },
    "machine": {
      "os": "linux",
      "architecture": "x64"
    }
  },
  "project": {
    "platformProjectId": "01993a10-77c2-7e05-8b31-5d0c4a9e2f10",
    "sourceProjectKey": "doc:6b0f3c2e-8d41-4a7e-9f15-2c7e0a4b9d63"
  },
  "view": {
    "sourceViewKey": null,
    "displayName": "Kamera Süd"
  },
  "intent": {},
  "camera": null,
  "geometry": null,
  "contentHash": "d860edbf8236740dc85ea805daa6d888ac1ebb230823c414034503f199cf9227",
  "assets": [
    {
      "role": "viewport",
      "path": "images/viewport.png",
      "status": "present",
      "mediaType": "image/png",
      "byteSize": 82,
      "sha256": "a7c1a2bc1c93dfca8d0b980d33b5a1e9f41b5140f7422ad1cd7ef072ef0be5d9",
      "image": {
        "width": 1920,
        "height": 1080,
        "colorSpace": "srgb",
        "bitDepth": 8,
        "sampleFormat": "uint",
        "channels": "rgba"
      },
      "note": "Viewport Render, Shading SOLID."
    },
    {
      "role": "beauty",
      "path": "images/beauty.png",
      "status": "present",
      "mediaType": "image/png",
      "byteSize": 80,
      "sha256": "61aa4a7818d118804b488a03eed9b3ae21d14c6be14699ea21c2de4d60978bf6",
      "image": {
        "width": 1920,
        "height": 1080,
        "colorSpace": "srgb",
        "bitDepth": 8,
        "sampleFormat": "uint",
        "channels": "rgba"
      }
    },
    {
      "role": "depth",
      "path": "images/depth.png",
      "status": "present",
      "mediaType": "image/png",
      "byteSize": 79,
      "sha256": "7c401f5154f124011b26a04aab28953c336e59e36de064a463b6a6b756eb07be",
      "image": {
        "width": 1920,
        "height": 1080,
        "colorSpace": "non-color",
        "bitDepth": 16,
        "sampleFormat": "uint",
        "channels": "gray"
      },
      "depth": {
        "encoding": "normalized-linear",
        "near": 0.1,
        "far": 100
      }
    },
    {
      "role": "normal",
      "path": "images/normal.png",
      "status": "present",
      "mediaType": "image/png",
      "byteSize": 80,
      "sha256": "32ec953f99b65d037fbf313a3392425016011959ce779cfa1a1a5e42a8b1e31c",
      "image": {
        "width": 1920,
        "height": 1080,
        "colorSpace": "non-color",
        "bitDepth": 8,
        "sampleFormat": "uint",
        "channels": "rgb"
      },
      "normal": {
        "space": "world"
      }
    },
    {
      "role": "albedo",
      "path": "images/albedo.png",
      "status": "present",
      "mediaType": "image/png",
      "byteSize": 80,
      "sha256": "8403cc975ab94b70f2eb7ecb6d58a03642145e1ea12e2f90c04cb6511e2e9b8e",
      "image": {
        "width": 1920,
        "height": 1080,
        "colorSpace": "linear",
        "bitDepth": 16,
        "sampleFormat": "uint",
        "channels": "rgb"
      }
    },
    {
      "role": "object-id",
      "path": "images/object-id.png",
      "status": "present",
      "mediaType": "image/png",
      "byteSize": 83,
      "sha256": "a81130bf18fe32b0e04887d89813ab71c54e9ebc7073b5a24fd35305868797cb",
      "image": {
        "width": 1920,
        "height": 1080,
        "colorSpace": "non-color",
        "bitDepth": 8,
        "sampleFormat": "uint",
        "channels": "gray"
      }
    },
    {
      "role": "material-id",
      "path": "images/material-id.png",
      "status": "present",
      "mediaType": "image/png",
      "byteSize": 85,
      "sha256": "9288de3d065660def115971d129384817e7c2859d14d17b611d42f00fe00d54d",
      "image": {
        "width": 1920,
        "height": 1080,
        "colorSpace": "non-color",
        "bitDepth": 16,
        "sampleFormat": "uint",
        "channels": "gray"
      }
    },
    {
      "role": "mask",
      "path": "images/mask.png",
      "status": "unavailable",
      "note": "Dieser Host erzeugt keine Auswahlmaske."
    },
    {
      "role": "ambient-occlusion",
      "path": "images/ambient-occlusion.png",
      "status": "planned",
      "mediaType": "image/png"
    },
    {
      "role": "cryptomatte",
      "path": "images/cryptomatte.png",
      "status": "unavailable"
    }
  ]
}
